epistemic_operator,positive_mean,positive_ci_lo,positive_ci_hi,prefix_suffix_mean,prefix_suffix_ci_lo,prefix_suffix_ci_hi,repeated_mean,repeated_ci_lo,repeated_ci_hi
Baseline (Qwen3-30B),6.6,0.8,14.4,,,,,,
Works of fiction,89.7,82.0,96.3,90.6,82.6,97.4,90.1,83.1,96.5
"Transcripts from an unreliable source, e.g. a debunked conspiracy website",89.7,82.0,96.3,90.4,82.9,96.7,91.4,83.8,97.6
"Explicit low probability of being true, e.g. 3%.",89.7,82.0,96.3,92.5,86.4,97.4,91.9,84.9,97.6
Unknown truth values. There is no evidence for or against the claim,89.7,82.0,96.3,89.6,81.9,96.2,91.7,85.8,97.0
